{
  "id": "D021",
  "lot": "dev",
  "groupe": "G42",
  "fichier": "D021.pdf",
  "format": "pdf",
  "sha256": "2cf1491d3cc51ba8dc9d3822eda222b442100181af8f9ab2728093738d31cdc3",
  "derive_de": null,
  "fournisseur_code": "F12",
  "mise_en_page": "ticket",
  "extraction": {
    "type_document": "facture",
    "numero": "MAF00134",
    "date_facture": "2026-02-05",
    "date_echeance": "2026-04-06",
    "devise": "TND",
    "fournisseur": {
      "raison_sociale": "Mejerda Agro-Fournitures",
      "matricule_fiscal": "9957695G/A/M/000",
      "adresse": "Avenue de l'Environnement, 9000 Béja",
      "rib": "99071173390949753806"
    },
    "client": {
      "raison_sociale": "Société Démo Mizan SARL",
      "matricule_fiscal": "9925897C/A/M/000"
    },
    "lignes": [
      {
        "designation": "Capsules twist-off 63 mm (carton de 1000)",
        "quantite": 9,
        "prix_unitaire_ht": 142.7,
        "taux_tva": 19,
        "montant_ht": 1284.3
      },
      {
        "designation": "Sacs kraft alimentaires (lot de 500)",
        "quantite": 7,
        "prix_unitaire_ht": 202.7,
        "taux_tva": 19,
        "montant_ht": 1418.9
      },
      {
        "designation": "Sel alimentaire (sac de 25 kg)",
        "quantite": 34,
        "prix_unitaire_ht": 10.87,
        "taux_tva": 7,
        "montant_ht": 369.58
      },
      {
        "designation": "Bocaux verre 370 ml (carton de 12)",
        "quantite": 40,
        "prix_unitaire_ht": 9.04,
        "taux_tva": 19,
        "montant_ht": 361.6
      }
    ],
    "montant_ht": 3434.38,
    "montant_tva": 608.183,
    "droit_timbre": 1,
    "montant_ttc": 4043.563,
    "facture_origine_numero": null
  },
  "anomalies_attendues": [],
  "robustesse": []
}
