{
  "id": "D055",
  "lot": "dev",
  "groupe": "G44",
  "fichier": "D055.pdf",
  "format": "pdf",
  "sha256": "192c8e87182fb9ec3d0babcba35944819265fe4c2c7cfe594a17cb5770f0b1b8",
  "derive_de": null,
  "fournisseur_code": "F04",
  "mise_en_page": "serif",
  "extraction": {
    "type_document": "facture",
    "numero": "TCL-00346",
    "date_facture": "2026-09-15",
    "date_echeance": "2026-11-14",
    "devise": "TND",
    "fournisseur": {
      "raison_sociale": "Trans-Cap Logistique",
      "matricule_fiscal": "9911957K/A/M/000",
      "adresse": "Route de Hammamet km 3, 8000 Nabeul",
      "rib": "99532548060714626340"
    },
    "client": {
      "raison_sociale": "Société Démo Mizan SARL",
      "matricule_fiscal": "9925897C/A/M/000"
    },
    "lignes": [
      {
        "designation": "Location camion avec chauffeur",
        "quantite": 3,
        "prix_unitaire_ht": 654.97,
        "taux_tva": 19,
        "montant_ht": 1964.91
      },
      {
        "designation": "Transport marchandises Tunis - Sfax",
        "quantite": 4,
        "prix_unitaire_ht": 468.74,
        "taux_tva": 13,
        "montant_ht": 1874.96
      },
      {
        "designation": "Transport marchandises Tunis - Sousse",
        "quantite": 3,
        "prix_unitaire_ht": 341.7,
        "taux_tva": 13,
        "montant_ht": 1025.1
      },
      {
        "designation": "Manutention",
        "quantite": 13.5,
        "prix_unitaire_ht": 29.64,
        "taux_tva": 19,
        "montant_ht": 400.14
      }
    ],
    "montant_ht": 5265.11,
    "montant_tva": 826.368,
    "droit_timbre": 1,
    "montant_ttc": 6092.478,
    "facture_origine_numero": null
  },
  "anomalies_attendues": [],
  "robustesse": []
}
