{
  "id": "D002",
  "lot": "test",
  "groupe": "G12",
  "fichier": "D002.pdf",
  "format": "pdf",
  "sha256": "d86584c58ec08840ed08eb3ce0215c52ff164b81e8c87389b57dbdbeed075aed",
  "derive_de": null,
  "fournisseur_code": "F06",
  "mise_en_page": "serif",
  "extraction": {
    "type_document": "facture",
    "numero": "BNM/2026/026",
    "date_facture": "2026-01-29",
    "date_echeance": "2026-02-28",
    "devise": "TND",
    "fournisseur": {
      "raison_sociale": "Bizerte Nord Maintenance Industrielle",
      "matricule_fiscal": "9942665K/A/M/000",
      "adresse": "3, rue de Mateur, 7000 Bizerte",
      "rib": "99607512589123410209"
    },
    "client": {
      "raison_sociale": "Société Démo Mizan SARL",
      "matricule_fiscal": "9925897C/A/M/000"
    },
    "lignes": [
      {
        "designation": "Huile hydraulique ISO 46",
        "quantite": 101,
        "prix_unitaire_ht": 9.04,
        "taux_tva": 19,
        "montant_ht": 913.04
      },
      {
        "designation": "Roulement à billes 6205",
        "quantite": 16,
        "prix_unitaire_ht": 14.68,
        "taux_tva": 19,
        "montant_ht": 234.88
      },
      {
        "designation": "Maintenance préventive compresseur",
        "quantite": 1,
        "prix_unitaire_ht": 597.66,
        "taux_tva": 19,
        "montant_ht": 597.66
      },
      {
        "designation": "Main-d'œuvre mécanicien",
        "quantite": 12,
        "prix_unitaire_ht": 51.53,
        "taux_tva": 19,
        "montant_ht": 618.36
      }
    ],
    "montant_ht": 2363.94,
    "montant_tva": 449.149,
    "droit_timbre": 1,
    "montant_ttc": 2819.667,
    "facture_origine_numero": null
  },
  "anomalies_attendues": [
    {
      "code": "ttc_incoherent",
      "detail": {
        "ttc_calcule": 2814.089,
        "ttc_imprime": 2819.667
      }
    }
  ],
  "robustesse": []
}
